{
  "personalization_phrase": "Вижу, что ваш учебный сервис помогает проверять публичные тексты до публикации. Мне близки такие проекты, где особенно важны системность, точность требований и воспроизводимость проверки материалов.",
  "overlap": "Учебный сервис и мой синтетический профиль относятся к воспроизводимой проверке материалов до публикации.",
  "offer_claim_ids": ["synthetic-review-before-publish"],
  "decision": "READY_FOR_REVIEW",
  "warnings": ["SYNTHETIC_OFFER_ONLY"]
}
